{
  "id": 1,
  "jsonrpc": "2.0",
  "method": "symbol/hierarchy",
  "params": {
    "depth": 2,
    "direction": "BOTH",
    "maxResults": 25,
    "pageToken": "example-pageToken",
    "selector": {
      "containingType": "com.example.Widget",
      "declarationFile": "example-declarationFile",
      "declarationStartOffset": 128,
      "fqName": "com.example.Widget",
      "kind": "UNKNOWN"
    },
    "workspaceRoot": "/absolute/path/to/workspace"
  }
}
